[
  {
    "slug": "data-center-campus",
    "name": "Data-center campus",
    "kind": "composite",
    "depth": "watched",
    "parcels": [
      "36-0100-03-002.000",
      "36-1200-02-001.001",
      "36-1200-03-001.000",
      "36-1200-03-001.001",
      "36-1200-03-001.002",
      "36-1200-03-001.003",
      "36-1200-03-001.004",
      "36-1200-03-001.005",
      "36-1200-03-001.006",
      "36-1200-03-002.000"
    ],
    "members": [],
    "aliases": [],
    "tags": [
      "datacenter",
      "campus",
      "bistrozzi"
    ],
    "location": {
      "method": "parcel-cama",
      "confidence": "high",
      "asof": "2026-06-09",
      "bbox": [
        -84.128403,
        40.787748,
        -84.118419,
        40.806044
      ]
    },
    "track": {
      "enabled": true,
      "collections": [
        "sentinel-2-l2a",
        "naip",
        "landsat-c2-l2"
      ],
      "since": null
    },
    "relationships": [
      {
        "role": "owner",
        "entity": "Bistrozzi LLC"
      }
    ],
    "citations": [
      {
        "source": "data/site/gis-findings.geojson",
        "source_kind": "document",
        "page": null,
        "confidence": "medium",
        "note": "(layer: campus; Allen County CAMA parcels, grantee Bistrozzi LLC)",
        "verified": true
      }
    ],
    "body": "Composite POI of the **10 Bistrozzi LLC parcels** that make up the data-center campus,\nported from the `campus` layer of\n[gis-findings.geojson](../site/gis-findings.geojson) — the seed that proves the store and\nthe first composite. It is the active imagery tracking site (`depth: watched`): the AOI\nbbox here is what `bosc imagery search/pull` clips to.\n\nGeometry/identity are the Allen County CAMA parcels listed in `parcels` (deed format);\nthe dedup `resolve` layer normalizes those to the county `PARCEL_NO` anchor. Members are\nnot yet broken out as atomic parcel POIs — the composite references its parcels directly\nuntil `discover`/`resolve` land. Values are verbatim from the county GIS via the\ncommitted findings; the campus grouping is an analyst composite, not a county object."
  }
]
